{
  "schemaVersion": "plm-diag/1",
  "refSchema": {
    "version": "ref-v0"
  },
  "run": {
    "gate": "always",
    "eco": false
  },
  "workspace": {
    "repos": [
      {
        "name": "repo"
      }
    ]
  },
  "stats": {
    "files": 5,
    "ids": 6,
    "refs": 11
  },
  "findings": []
}
